{
  "schema_version": "tawg.daily-result.v1",
  "window_id": "daily:2026-08-23T23:00:00Z",
  "window_start": "2026-08-22T23:00:00Z",
  "window_end": "2026-08-23T23:00:00Z",
  "telegram_text": "🌱 TAWG Daily Catch-up — 2026-08-22 23:00 UTC → 2026-08-23 23:00 UTC\n\nA quieter day can still be useful breathing room. No source-backed progress landed in this window.\n\n🤝 What moved\nNo source-backed progress landed in this window.\n\n🚀 Next up\n💡 ideas to follow\n• Bring one question, review, or small update into the group for the next catch-up.\n✅ todos\n• Share one concrete uncertainty with the group.\n\nSee you at the next catch-up. 🌱",
  "citations": [],
  "quiet_day": true
}
