{
  "schema_version": "tawg.daily-result.v1",
  "window_id": "daily:2026-08-23T23:00:00Z",
  "window_start": "2026-08-22T23:00:00Z",
  "window_end": "2026-08-23T23:00:00Z",
  "telegram_text": "🗓 **TAWG Daily Catch-up**\n_2026-08-22 23:00 → 2026-08-23 23:00 UTC_\n\n## ⚡ **Highlights**\n\n> **Validation path clarified** — The next implementation pass has a clearer direction. [tg:tawg:1]\n\n## 🤝 **What moved**\n\n### agent-sdk\n\n_The validation direction became clearer and easier to build on this window._\n\n- Alice — **Clarified** ERC-8004 validation behavior, advancing the next implementation pass and giving the group a clearer path toward verifiable Trustless AI integration. [tg:tawg:1]\n\n## 🚀 **Next up**\n\n### 💡 **Ideas to follow**\n\n- Keep the validation path verifiable while simplifying integration.\n\n### ✅ **TODOs**\n\n- A second review of the edge cases would help turn the proposal into a shared decision.\n\n## 🤖 **Trusty's take**\n\n> **Today's spark:** The validation discussion turned uncertainty into a clearer next implementation path for the whole group.\n>\n> That's one less fog bank for the builders. Keep poking the edges, TAWG. 🤖",
  "citations": [
    "tg:tawg:1"
  ],
  "quiet_day": false
}
